{
  "schema": "../contracts/traceability.schema.json",
  "matrix_id": "FORGE_REQUIREMENTS_TRACEABILITY_001",
  "source": "docs/product/FORGE_REQUIREMENTS_TRACEABILITY_MATRIX.md",
  "coverage_rule": "Every product capability must have traceability before a generating stage may be READY.",
  "entries": [
    {"capability_id":"CAP-DECISION-CORE","requirement_id":"REQ-DECISION-EVIDENCE-ACTION","constitutional_authority":["CONSTITUTION_ARTICLE_III","CONSTITUTION_ARTICLE_V"],"boundaries":["BOUND-EVIDENCE-OWNERSHIP"],"adr":["ADR-001","ADR-002","ADR-003","ADR-004","ADR-020"],"contract":"scaffolds/contracts/scaffold-contract.schema.json","stage":"SG-002","scaffold":"scaffolds/templates/module","validation":["validate-traceability","validate-stage"],"evidence":"scaffolds/reports/SG-002-evidence.json","acceptance":"Decision output includes evidence, owner, confidence and action boundary."},
    {"capability_id":"CAP-ACTION-PLANNING","requirement_id":"REQ-ACTION-RECOMMENDATION-NOT-EXECUTION","constitutional_authority":["CONSTITUTION_ARTICLE_IV","CONSTITUTION_ARTICLE_V"],"boundaries":["BOUND-ACTION-NO-EXECUTION"],"adr":["ADR-003","ADR-009","ADR-012"],"contract":"scaffolds/contracts/scaffold-contract.schema.json","stage":"SG-002","scaffold":"scaffolds/templates/service","validation":["validate-traceability","validate-stage"],"evidence":"scaffolds/reports/SG-002-evidence.json","acceptance":"Action plans recommend but do not execute real-world effects."},
    {"capability_id":"CAP-TRUTH-EVIDENCE","requirement_id":"REQ-TRUTH-OWNER-VALIDATION","constitutional_authority":["CONSTITUTION_ARTICLE_III"],"boundaries":["BOUND-ONE-METRIC-ONE-OWNER","BOUND-UNKNOWN-REMAINS-UNKNOWN"],"adr":["ADR-001","ADR-002","ADR-014"],"contract":"scaffolds/contracts/traceability.schema.json","stage":"SG-001","scaffold":"scaffolds/templates/documentation","validation":["validate-product-spec","validate-traceability"],"evidence":"scaffolds/reports/SG-001-evidence.json","acceptance":"Unknown or ambiguous owners block generation."},
    {"capability_id":"CAP-GOVERNANCE-GATE","requirement_id":"REQ-ROBOCOP-GATE","constitutional_authority":["CONSTITUTION_ARTICLE_VIII"],"boundaries":["BOUND-ROBOCOP-GATE"],"adr":["ROBOCOP_LOCK_001"],"contract":"scaffolds/contracts/promotion-gate.schema.json","stage":"SG-001","scaffold":"scaffolds/templates/documentation","validation":["validate-boundaries","validate-stage"],"evidence":"scaffolds/reports/SG-001-evidence.json","acceptance":"Missing governance gate fields block."},
    {"capability_id":"CAP-READ-ONLY-ADAPTERS","requirement_id":"REQ-READ-ONLY-NO-WRITES","constitutional_authority":["CONSTITUTION_ARTICLE_III","CONSTITUTION_ARTICLE_IV","CONSTITUTION_ARTICLE_V"],"boundaries":["BOUND-READ-ONLY"],"adr":["ADR-003","ADR-004"],"contract":"scaffolds/contracts/scaffold-contract.schema.json","stage":"SG-002","scaffold":"scaffolds/templates/service","validation":["validate-scaffold","validate-stage"],"evidence":"scaffolds/reports/SG-002-evidence.json","acceptance":"Adapters expose reads and evidence only; no writes are scaffolded."},
    {"capability_id":"CAP-RELATIONSHIP-INTELLIGENCE","requirement_id":"REQ-RELATIONSHIP-NON-MANIPULATION","constitutional_authority":["CONSTITUTION_ARTICLE_III","CONSTITUTION_ARTICLE_IV","CONSTITUTION_ARTICLE_VI"],"boundaries":["BOUND-RELATIONSHIP-NON-MANIPULATION"],"adr":["ADR-011","ADR-020"],"contract":"scaffolds/contracts/stage-contract.schema.json","stage":"SG-003","scaffold":"scaffolds/templates/domain","validation":["validate-traceability","validate-stage"],"evidence":"scaffolds/reports/SG-003-evidence.json","acceptance":"Relationship output has one evidenced next action and no manipulation."},
    {"capability_id":"CAP-CONVERSATION-INTELLIGENCE","requirement_id":"REQ-NASH-DRAFTS-NOT-TRUTH","constitutional_authority":["CONSTITUTION_ARTICLE_VI"],"boundaries":["BOUND-NASH-NO-TRUTH","BOUND-AI-EXPLAINS-FORGE-DECIDES"],"adr":["ADR-010","ADR-020"],"contract":"scaffolds/contracts/stage-contract.schema.json","stage":"SG-004","scaffold":"scaffolds/templates/domain","validation":["validate-traceability","validate-stage"],"evidence":"scaffolds/reports/SG-004-evidence.json","acceptance":"Conversation guidance cannot own truth, decide or send."},
    {"capability_id":"CAP-POLICY-OPERATIONS","requirement_id":"REQ-POLICY-TRUTH-SEPARATION","constitutional_authority":["CONSTITUTION_ARTICLE_III","CONSTITUTION_ARTICLE_V"],"boundaries":["BOUND-POLICY-TRUTH"],"adr":["ADR-006"],"contract":"scaffolds/contracts/stage-contract.schema.json","stage":"SG-005","scaffold":"scaffolds/templates/domain","validation":["validate-traceability","validate-stage"],"evidence":"scaffolds/reports/SG-005-evidence.json","acceptance":"Issued policy truth is not quote, forecast or paid-premium truth."},
    {"capability_id":"CAP-PRODUCT-CATALOG","requirement_id":"REQ-PRODUCT-CATALOG-CONTRACT","constitutional_authority":["CONSTITUTION_ARTICLE_III","CONSTITUTION_ARTICLE_V"],"boundaries":["BOUND-PRODUCT-TRUTH","BOUND-UNKNOWN-REMAINS-UNKNOWN"],"adr":["ADR-005"],"contract":"scaffolds/contracts/scaffold-contract.schema.json","stage":"SG-006","scaffold":"scaffolds/templates/domain","validation":["validate-traceability","validate-stage"],"evidence":"scaffolds/reports/SG-006-evidence.json","acceptance":"Catalog contract exists without invented commercial values."},
    {"capability_id":"CAP-PRODUCT-SOURCE-PACK","requirement_id":"REQ-PRODUCT-SOURCE-PACK-INTAKE","constitutional_authority":["CONSTITUTION_ARTICLE_III"],"boundaries":["BOUND-PRODUCT-TRUTH","BOUND-NO-LEGACY-CODE-COPY"],"adr":["ADR-005"],"contract":"scaffolds/contracts/evidence-contract.schema.json","stage":"SG-007","scaffold":"scaffolds/templates/migration","validation":["validate-evidence","validate-stage"],"evidence":"scaffolds/reports/SG-007-evidence.json","acceptance":"Source packs require owner-approved commercial documents."},
    {"capability_id":"CAP-CARRIER-SCOPE","requirement_id":"REQ-CARRIER-SCOPE-SEPARATION","constitutional_authority":["CONSTITUTION_ARTICLE_V"],"boundaries":["BOUND-RULE-PACK-SEPARATION","BOUND-PRODUCT-TRUTH"],"adr":["ADR-005","ADR-008"],"contract":"scaffolds/contracts/scaffold-contract.schema.json","stage":"SG-008","scaffold":"scaffolds/templates/domain","validation":["validate-traceability","validate-stage"],"evidence":"scaffolds/reports/SG-008-evidence.json","acceptance":"Carrier scope remains outside universal Forge Core."},
    {"capability_id":"CAP-RULE-PACK-CONTRACT","requirement_id":"REQ-RULE-PACK-CONTRACT","constitutional_authority":["CONSTITUTION_ARTICLE_V"],"boundaries":["BOUND-RULE-PACK-SEPARATION"],"adr":["ADR-008","ADR-017","ADR-018"],"contract":"scaffolds/contracts/stage-contract.schema.json","stage":"SG-009","scaffold":"scaffolds/templates/domain","validation":["validate-traceability","validate-stage"],"evidence":"scaffolds/reports/SG-009-evidence.json","acceptance":"Rule Pack contract preserves carrier, channel, period and snapshot boundaries."},
    {"capability_id":"CAP-ELIGIBILITY-CONTRACT","requirement_id":"REQ-ELIGIBILITY-CONTRACT","constitutional_authority":["CONSTITUTION_ARTICLE_III","CONSTITUTION_ARTICLE_V"],"boundaries":["BOUND-RULE-PACK-SEPARATION","BOUND-UNKNOWN-REMAINS-UNKNOWN"],"adr":["ADR-008"],"contract":"scaffolds/contracts/stage-contract.schema.json","stage":"SG-010","scaffold":"scaffolds/templates/domain","validation":["validate-traceability","validate-stage"],"evidence":"scaffolds/reports/SG-010-evidence.json","acceptance":"Eligibility exposes facts, rules, confidence and unknown states."},
    {"capability_id":"CAP-CALCULATION-CONTRACT","requirement_id":"REQ-CALCULATION-CONTRACT","constitutional_authority":["CONSTITUTION_ARTICLE_III"],"boundaries":["BOUND-ECONOMIC-EVIDENCE","BOUND-FORECAST-NOT-FACT"],"adr":["ADR-008","ADR-017"],"contract":"scaffolds/contracts/stage-contract.schema.json","stage":"SG-011","scaffold":"scaffolds/templates/domain","validation":["validate-traceability","validate-stage"],"evidence":"scaffolds/reports/SG-011-evidence.json","acceptance":"Calculations do not invent values or mix periods."},
    {"capability_id":"CAP-QUOTE-PREVIEW","requirement_id":"REQ-QUOTE-PREVIEW-NON-BINDING","constitutional_authority":["CONSTITUTION_ARTICLE_III","CONSTITUTION_ARTICLE_V"],"boundaries":["BOUND-PRODUCT-TRUTH","BOUND-FORECAST-NOT-FACT"],"adr":["ADR-005","ADR-008","ADR-017"],"contract":"scaffolds/contracts/stage-contract.schema.json","stage":"SG-012","scaffold":"scaffolds/templates/feature","validation":["validate-traceability","validate-stage"],"evidence":"scaffolds/reports/SG-012-evidence.json","acceptance":"Quote preview is non-binding and evidence-labeled."},
    {"capability_id":"CAP-MANAGER-COACHING","requirement_id":"REQ-MANAGER-COACHING-ONLY","constitutional_authority":["CONSTITUTION_ARTICLE_IV","CONSTITUTION_ARTICLE_VI"],"boundaries":["BOUND-MANAGER-COACHING-ONLY","BOUND-NO-HUMAN-CONSEQUENCE-AUTOMATION"],"adr":["ADR-015"],"contract":"scaffolds/contracts/stage-contract.schema.json","stage":"SG-013","scaffold":"scaffolds/templates/domain","validation":["validate-traceability","validate-stage"],"evidence":"scaffolds/reports/SG-013-evidence.json","acceptance":"Manager Coaching recommends leadership action without automated consequence."},
    {"capability_id":"CAP-MICK-BEHAVIOR","requirement_id":"REQ-MICK-OBSERVABLE-ONLY","constitutional_authority":["CONSTITUTION_ARTICLE_VI"],"boundaries":["BOUND-MICK-OBSERVABLE-BEHAVIOR","BOUND-NO-HUMAN-WORTH"],"adr":["ADR-013"],"contract":"scaffolds/contracts/stage-contract.schema.json","stage":"SG-014","scaffold":"scaffolds/templates/domain","validation":["validate-traceability","validate-stage"],"evidence":"scaffolds/reports/SG-014-evidence.json","acceptance":"Mick emits observable behavior signals only."},